<?xml version="1.0" encoding="ISO-8859-1" ?>
<classes xmlns:xsi="http://www.w3.org/2001/XMLSchema-instance"
	xsi:noNamespaceSchemaLocation="classes.xsd">

    <class identifier="Person">
        <package>gen.org.mwolff.generatorexamples.entity</package>
        <classcomment>Structure of a Person class.</classcomment>
        <author>Manfred Wolff</author>
        <version>1.0.0</version>
        <template>class-template.vm</template>
        <instancevariables>
            <instancevariable id="name" type="String" scope="private"/>
            <instancevariable id="prename" type="String" scope="private"/>
            <instancevariable id="adress" type="Adress" scope="private" cardinality="one-many"/>
        </instancevariables>
    </class>

    <class identifier="Adress">
        <package>gen.org.mwolff.generatorexamples.entity</package>
        <classcomment>Structure of a Address class.</classcomment>
        <author>Manfred Wolff</author>
        <version>1.0.0</version>
        <template>class-template.vm</template>
        <instancevariables>
            <instancevariable id="zip" type="String" scope="private"/>
            <instancevariable id="street" type="String" scope="private"/>
            <instancevariable id="city" type="String" scope="private"/>
        </instancevariables>
    </class>
</classes>   

